<?xml version='1.0' encoding='UTF-8'?><!DOCTYPE collection SYSTEM 'BioC.dtd'>
<collection>
<source>PubTator</source>
<date>0/0/0</date>
<key>PubTator.key</key>
<document>
<id>26094</id>
<passage>
<infon key="type">title</infon>
<offset>0</offset>
<text>Antihypertensive drugs and depression: a reappraisal.</text>
<annotation id='1'>
<infon key="type">Disease</infon>
<infon key='MESH'>D003866</infon>
<infon key="score">0.792633056640625</infon>
<location offset='27' length='10' />
<text>depression</text>
</annotation>
</passage>
<passage>
<infon key="type">abstract</infon>
<offset>54</offset>
<text>Eighty-nine new referral hypertensive out-patients and 46 new referral non-hypertensive chronically physically ill out-patients completed a mood rating scale at regular intervals for one year. The results showed a high prevalence of depression in both groups of patients, with no preponderance in the hypertensive group. Hypertensive patients with psychiatric histories had a higher prevalence of depression than the comparison patients. This was accounted for by a significant number of depressions occurring in methyl dopa treated patients with psychiatric histories.</text>
<annotation id='2'>
<infon key="type">Disease</infon>
<infon key='MESH'>D006973</infon>
<infon key="score">0.47882080078125</infon>
<location offset='79' length='12' />
<text>hypertensive</text>
</annotation>
<annotation id='3'>
<infon key="type">Disease</infon>
<infon key='MESH'>D006973</infon>
<infon key="score">0.47882080078125</infon>
<location offset='129' length='12' />
<text>hypertensive</text>
</annotation>
<annotation id='4'>
<infon key="type">Disease</infon>
<infon key='MESH'>D003866</infon>
<infon key="score">0.792633056640625</infon>
<location offset='287' length='10' />
<text>depression</text>
</annotation>
<annotation id='5'>
<infon key="type">Disease</infon>
<infon key='MESH'>D006973</infon>
<infon key="score">0.47882080078125</infon>
<location offset='355' length='12' />
<text>hypertensive</text>
</annotation>
<annotation id='6'>
<infon key="type">Disease</infon>
<infon key='MESH'>D006973</infon>
<infon key="score">0.47882080078125</infon>
<location offset='375' length='12' />
<text>Hypertensive</text>
</annotation>
<annotation id='7'>
<infon key="type">Disease</infon>
<infon key='MESH'>D003866</infon>
<infon key="score">0.792633056640625</infon>
<location offset='451' length='10' />
<text>depression</text>
</annotation>
<annotation id='8'>
<infon key="type">Disease</infon>
<infon key='MESH'>D003866</infon>
<infon key="score">0.792633056640625</infon>
<location offset='542' length='11' />
<text>depressions</text>
</annotation>
</passage>
</document>
<document>
<id>354896</id>
<passage>
<infon key="type">title</infon>
<offset>0</offset>
<text>Lidocaine-induced cardiac asystole.</text>
<annotation id='3'>
<infon key="type">Disease</infon>
<infon key='MESH'>D006331</infon>
<infon key="score">0.93243408203125</infon>
<location offset='18' length='16' />
<text>cardiac asystole</text>
</annotation>
</passage>
<passage>
<infon key="type">abstract</infon>
<offset>36</offset>
<text>Intravenous administration of a single 50-mg bolus of lidocaine in a 67-year-old man resulted in profound depression of the activity of the sinoatrial and atrioventricular nodal pacemakers. The patient had no apparent associated conditions which might have predisposed him to the development of bradyarrhythmias; and, thus, this probably represented a true idiosyncrasy to lidocaine.</text>
<annotation id='4'>
<infon key="type">Disease</infon>
<infon key='MESH'>D003866</infon>
<infon key="score">0.792633056640625</infon>
<location offset='142' length='10' />
<text>depression</text>
</annotation>
<annotation id='5'>
<infon key="type">Disease</infon>
<infon key='MESH'>D009135</infon>
<infon key="score">0.36505126953125</infon>
<location offset='265' length='10' />
<text>conditions</text>
</annotation>
<annotation id='6'>
<infon key="type">Disease</infon>
<infon key='MESH'>D001919</infon>
<infon key="score">0.7236328125</infon>
<location offset='331' length='16' />
<text>bradyarrhythmias</text>
</annotation>
</passage>
</document>
<document>
<id>1720453</id>
<passage>
<infon key="type">title</infon>
<offset>0</offset>
<text>Long-term follow-up of ifosfamide renal toxicity in children treated for malignant mesenchymal tumors: an International Society of Pediatric Oncology report.</text>
<annotation id='12'>
<infon key="type">Disease</infon>
<infon key='MESH'>D007674</infon>
<infon key="score">0.369049072265625</infon>
<location offset='34' length='14' />
<text>renal toxicity</text>
</annotation>
<annotation id='13'>
<infon key="type">Disease</infon>
<infon key='MESH'>D009369</infon>
<infon key="score">0.31304931640625</infon>
<location offset='83' length='18' />
<text>mesenchymal tumors</text>
</annotation>
</passage>
<passage>
<infon key="type">abstract</infon>
<offset>158</offset>
<text>The renal function of 74 children with malignant mesenchymal tumors in complete remission and who have received the same ifosfamide chemotherapy protocol (International Society of Pediatric Oncology Malignant Mesenchymal Tumor Study 84 [SIOP MMT 84]) were studied 1 year after the completion of treatment. Total cumulative doses were 36 or 60 g/m2 of ifosfamide (six or 10 cycles of ifosfamide, vincristine, and dactinomycin [IVA]). None of them had received cisplatin chemotherapy. Ages ranged from 4 months to 17 years; 58 patients were males and 42 females. The most common primary tumor site was the head and neck. Renal function was investigated by measuring plasma and urinary electrolytes, glucosuria, proteinuria, aminoaciduria, urinary pH, osmolarity, creatinine clearance, phosphate tubular reabsorption, beta 2 microglobulinuria, and lysozymuria. Fifty-eight patients (78%) had normal renal tests, whereas 16 patients (22%) had renal abnormalities. Two subsets of patients were identified from this latter group: the first included four patients (5% of the total population) who developed major toxicity resulting in Fanconi&apos;s syndrome (TDFS); and the second group included five patients with elevated beta 2 microglobulinuria and low phosphate reabsorption. The remaining seven patients had isolated beta 2 microglobulinuria. Severe toxicity was correlated with the higher cumulative dose of 60 g/m2 of ifosfamide, a younger age (less than 2 1/2 years old), and a predominance of vesicoprostatic tumor involvement. This low percentage (5%) of TDFS must be evaluated with respect to the efficacy of ifosfamide in the treatment of mesenchymal tumors in children.</text>
<annotation id='14'>
<infon key="type">Disease</infon>
<infon key='MESH'>D009369</infon>
<infon key="score">0.31304931640625</infon>
<location offset='207' length='18' />
<text>mesenchymal tumors</text>
</annotation>
<annotation id='15'>
<infon key="type">Disease</infon>
<infon key='MESH'>D009369</infon>
<infon key="score">0.31304931640625</infon>
<location offset='379' length='5' />
<text>Tumor</text>
</annotation>
<annotation id='16'>
<infon key="type">Disease</infon>
<infon key='MESH'>D009369</infon>
<infon key="score">0.31304931640625</infon>
<location offset='743' length='5' />
<text>tumor</text>
</annotation>
<annotation id='17'>
<infon key="type">Disease</infon>
<infon key='MESH'>D011507</infon>
<infon key="score">0.045166015625</infon>
<location offset='867' length='11' />
<text>proteinuria</text>
</annotation>
<annotation id='18'>
<infon key="type">Disease</infon>
<infon key='MESH'>D000608</infon>
<infon key="score">0.47625732421875</infon>
<location offset='880' length='13' />
<text>aminoaciduria</text>
</annotation>
<annotation id='19'>
<infon key="type">Disease</infon>
<infon key='MESH'>D007674</infon>
<infon key="score">0.369049072265625</infon>
<location offset='1097' length='19' />
<text>renal abnormalities</text>
</annotation>
<annotation id='20'>
<infon key="type">Disease</infon>
<infon key='MESH'>D014786</infon>
<infon key="score">0.841217041015625</infon>
<location offset='1264' length='8' />
<text>toxicity</text>
</annotation>
<annotation id='21'>
<infon key="type">Disease</infon>
<infon key='MESH'>D005199</infon>
<infon key="score">0.649993896484375</infon>
<location offset='1286' length='18' />
<text>Fanconi&apos;s syndrome</text>
</annotation>
<annotation id='22'>
<infon key="type">Disease</infon>
<infon key='MESH'>D014786</infon>
<infon key="score">0.841217041015625</infon>
<location offset='1503' length='8' />
<text>toxicity</text>
</annotation>
<annotation id='23'>
<infon key="type">Disease</infon>
<infon key='MESH'>D009369</infon>
<infon key="score">0.31304931640625</infon>
<location offset='1666' length='5' />
<text>tumor</text>
</annotation>
<annotation id='24'>
<infon key="type">Disease</infon>
<infon key='MESH'>D009369</infon>
<infon key="score">0.31304931640625</infon>
<location offset='1799' length='18' />
<text>mesenchymal tumors</text>
</annotation>
</passage>
</document>
<document>
<id>2224762</id>
<passage>
<infon key="type">title</infon>
<offset>0</offset>
<text>A phase I study of 4&apos;-0-tetrahydropyranyladriamycin. Clinical pharmacology and pharmacokinetics.</text>
</passage>
<passage>
<infon key="type">abstract</infon>
<offset>102</offset>